{
  "schema_version": "1.0",
  "kind": "wiz_evidence",
  "source": {
    "system": "wiz",
    "mode": "synthetic",
    "export_id": "synthetic-demo-export",
    "exported_at": "2026-09-19T12:00:00Z",
    "tenant_id": "22222222-2222-2222-2222-222222222222",
    "mapping_version": "1.0",
    "scope": {
      "subscription_ids": [
        "11111111-1111-1111-1111-111111111111"
      ],
      "resource_group": null
    },
    "inventory_complete": true,
    "findings_complete": true
  },
  "resources": [
    {
      "wiz_id": "synthetic-matched",
      "resource_id": "/subscriptions/11111111-1111-1111-1111-111111111111/resourceGroups/audit-demo/providers/Microsoft.Storage/storageAccounts/matched",
      "observed_at": "2026-09-19T12:00:00Z"
    },
    {
      "wiz_id": "synthetic-wiz-only",
      "resource_id": "/subscriptions/11111111-1111-1111-1111-111111111111/resourceGroups/audit-demo/providers/Microsoft.Storage/storageAccounts/wiz-only",
      "observed_at": "2026-09-19T12:00:00Z"
    }
  ],
  "findings": [
    {
      "finding_id": "synthetic-finding-1",
      "resource_id": "/subscriptions/11111111-1111-1111-1111-111111111111/resourceGroups/audit-demo/providers/Microsoft.Storage/storageAccounts/matched",
      "rule_id": "synthetic-unrelated-rule",
      "severity": "HIGH",
      "status": "OPEN",
      "observed_at": "2026-09-19T12:00:00Z"
    }
  ]
}
